{
  "id": "U1",
  "title": "ناتوانی در نوشتن",
  "source_units": ["N001", "N002"],
  "source_evidence": {
    "quote": "از دیروز تا حالا هر چه فکر می‌کنم چیزی ندارم که بنویسم. مثل اینست که کسی دست مرا می‌گیرد یا بازویم بی‌حس می‌شود.",
    "location": "بخش آغازین، پیش از توصیف آسایشگاه",
    "context": "راوی پس از یک سال محرومیت از کاغذ و قلم، در آستانهٔ نوشتن می‌ماند."
  },
  "dominance": {
    "source_dominance": "نوشتن = تولید روایت؛ راوی = دسترسی به حقیقت.",
    "source_protocol": "ورودی ذهنی → روایت منسجم → خواننده اطلاعات می‌گیرد.",
    "intervention": "سیستم ورودی بازیکن را می‌پذیرد، اما خروجی روایی تولید نمی‌کند.",
    "de_dominance_function": "تعلیق عاملیت سوژه در خلأ انتظار: متن وجود دارد، اما روایت تولید نمی‌شود.",
    "suspension": "بازیکن در خلأ خروجی معلق می‌ماند و عاملیت تعاملی‌اش بی‌اثر می‌شود."
  },
  "equivalence": {
    "print": "اعتماد به راوی → اعلام ناتوانی در نوشتن → بحران اعتماد به کانال روایی",
    "computer": "انتظار ورودی/خروجی → پذیرش ورودی و امتناع از خروجی معنادار → بحران اعتماد به کانال",
    "shared_function": "بحران اعتماد به کانال روایی/تعاملی"
  },
  "techniques": ["discontinuity", "smoothness"],
  "narrative": {
    "function": "آستانهٔ قاب روایی و تثبیت راوی نامطمئن.",
    "characters": "راوی؛ ناظم و هم‌اتاقی‌ها در پس‌زمینه.",
    "space": "اتاق/صفحهٔ نوشتن به‌مثابه فضای بسته.",
    "information": "خواننده می‌فهمد روایت قابل‌اعتماد نیست، اما نمی‌داند چه چیزی حقیقت است."
  },
  "game": {
    "verb": "نوشتن/تلاش برای تولید متن.",
    "goal": "بازیکن می‌خواهد نوشته‌اش ثبت شود و روایت پیش برود.",
    "obstacle": "سیستم از خروجی معنادار امتناع می‌کند.",
    "failure": "تکرار بی‌نتیجه و فرسایش؛ امکان رهاکردن صفحه.",
    "choice": "ادامهٔ نوشتن یا رهاکردن/پذیرش خلأ.",
    "consequence": "ادامه، موتیف را تثبیت می‌کند؛ رهاکردن، قاب روایی را باز می‌کند.",
    "feedback": "نشانگر، صدای تایپ، حذف تدریجی متن، ظهور «سه قطره خون»."
  },
  "domains": {
    "game_design": {
      "thesis": "فعل نوشتن باید به تجربهٔ امتناع از خروجی تبدیل شود، نه به یک دکمهٔ «بعدی».",
      "artifact": "تعامل تایپ + حالت input_count + شرط خروجی + بازخورد.",
      "removal_test": "حذف تعامل، بحران کانال را به متن توضیحی تبدیل می‌کند."
    },
    "technical": {
      "thesis": "ماشین حالت باید ورودی را ثبت کند و خروجی را مشروط/ممتنع کند.",
      "artifact": "state machine + فیلتر خروجی + ذخیرهٔ تلاش‌ها.",
      "removal_test": "بدون ماشین حالت، امتناع تصادفی و غیرقابل‌تکرار می‌شود."
    },
    "ai": {
      "thesis": "عاملیت سیستم باید قابل‌ادراک باشد، نه یک تصادف.",
      "artifact": "منطق پاسخ‌دهی/امتناع با قواعد شفاف.",
      "removal_test": "حذف منطق، تجربه را به باگ نزدیک می‌کند.",
      "na_reason": "NPC انسانی در این واحد نقش مستقیم ندارد؛ سیستم به‌عنوان عامل عمل می‌کند."
    },
    "art": {
      "thesis": "صفحهٔ سفید/نشانگر/محو شدن متن باید فشار فضایی بسازد.",
      "artifact": "art bible صفحه + انیمیشن نشانگر + VFX محو.",
      "removal_test": "حذف بازخورد بصری، امتناع را نامرئی می‌کند."
    },
    "ui_ux": {
      "thesis": "رابط باید وعدهٔ نوشتن بدهد و سپس آن وعده را به‌طور قابل‌فهم نقض کند.",
      "artifact": "onboarding + نشانگر + پیام ثبت + بازخورد خطا.",
      "removal_test": "بدون وعده/بازخورد، بازیکن فکر می‌کند کنترل خراب است."
    },
    "audio": {
      "thesis": "صدای تایپ/سکوت باید انتظار خروجی را بسازد و سپس فرو بریزد.",
      "artifact": "SFX تایپ + امبیانس اتاق + سکوت کنترل‌شده.",
      "removal_test": "حذف صدا، ریتم انتظار/فروپاشی را ضعیف می‌کند."
    },
    "story_content": {
      "thesis": "این واحد باید قاب روایی و راوی نامطمئن را معرفی کند، نه کل قصه را توضیح دهد.",
      "artifact": "دیالوگ/متن کوتاه + حالت روایی + اشاره به موتیف.",
      "removal_test": "حذف واحد، انگیزهٔ خواندن/بازی و قاب قصه از بین می‌رود."
    }
  },
  "free_space": [
    {
      "question": "چه مدت تا امتناع سیستم؟",
      "decision": "متوسط",
      "reason": "فرصت کشف قاعده بدون تبدیل به شکنجه."
    },
    {
      "question": "آیا سیستم عذرخواهی می‌کند؟",
      "decision": "خیر",
      "reason": "عذرخواهی، شکاف را به نقص فنی نزدیک می‌کند."
    }
  ],
  "untranslatability": {
    "item": "استعارهٔ «بازوی بی‌حس»",
    "why": "معادل بدنی کامل در تعامل دیجیتال ندارد.",
    "replacement": "تأخیر/تکرار/حذف متن",
    "loss": "حس بدنی مستقیم استعاره"
  },
  "acceptance": {
    "evidence": "",
    "criteria": "بازیکن باید امتناع را عمدی بفهمد و بتواند قاب روایی را بازگو کند.",
    "status": "unverified"
  },
  "status": "draft",
  "notes": "این کارت نمونه است؛ پلی‌تست نشده و اعتبار تجربی ندارد."
}
